{
  "$schema": "https://unpkg.com/@nxpress/core@latest/schema.json",
  "port": 3001,
  "engine": "ejs",
  "appDir": "app",
  "componentsDir": "components",
  "publicDir": "public",
  "i18n": {
    "locales": ["fr", "en"],
    "defaultLocale": "en"
  },
  "globals": {
     "siteName": "Nexpress EJS Store",
    "author": "Nexpress Team",
    "version": "1.0.0",
    "currency": "€",
    "title": "Tesd",
    "description": ""
  }
}
