{
  "$schema": "https://www.unpkg.com/@nxpress/core@latest/schema.json",
  "port": 3001,
  "engine": "ejs",
  "appDir": "app",
  "componentsDir": "components",
  "publicDir": "public",
  "i18n": {
    "locales": ["en", "fr"],
    "defaultLocale": "en"
  },
  "globals": {
    "siteName": "Homedine",
    "author": "Homedine Organics",
    "version": "1.0.0",
    "currency": "$"
  }
}
